lang,word_original,word_translation,blank_prompt_original,blank_prompt_translation
de,speech,Rede,"""A ""speech"" is a formal address or discourse delivered to an audience. Answer: ""speech"".""","""Eine ""Rede"" ist eine förmliche Ansprache oder ein Vortrag, der vor einem Publikum gehalten wird. Antwort: ""Rede""."""
de,child,Kind,"'A ""child"" is a young human being below the age of puberty. Answer: ""child"".'","Ein ""Kind"" ist ein junges menschliches Wesen unter dem Alter der Pubertät. Antwort: ""Kind"".'"
de,tower,Turm,"A ""tower"" is a tall structure that can be used for various purposes such as observation, communication, or storage. Answer: ""tower"".","Ein ""Turm"" ist ein hohes Bauwerk, das für verschiedene Zwecke wie Beobachtung, Kommunikation oder Lagerung genutzt werden kann. Antwort: ""Turm""."
de,hair,Haar,"A ""hair"" is found on the heads of humans and animals. Answer: ""hair"".","Ein ""Haar"" befindet sich auf dem Kopf von Menschen und Tieren. Antwort: ""Haar""."
de,flat,flach,"A ""book"" is often flat and used for reading. Answer: ""book"".","Ein ""Buch"" ist oft flach und wird zum Lesen verwendet. Antwort: ""Buch""."
de,male,männlich,"'A ""man"" is an example of a male. Answer: ""man"".'","Ein ""Mann"" ist ein Beispiel für ein männliches Wesen. Antwort: 'Mann'.'"
de,electric,elektrisch,"An ""electricity"" is used to power devices. Answer: ""electricity"".","Ein ""Strom"" wird zur Versorgung von Geräten verwendet. Antwort: ""Elektrizität""."
de,household,Haushalt,"A ""household"" is a term used to describe a residential unit where people live. Answer: ""household"".","Ein ""Haushalt"" ist eine Bezeichnung für eine Wohneinheit, in der Menschen leben. Antwort: ""Haushalt""."
de,person,Person,"'A ""person"" is a human being regarded as an individual. Answer: ""person"".'","Eine ""Person"" ist ein menschliches Wesen, das als Individuum betrachtet wird. Antwort: 'Person'.'"
de,section,Abschnitt,"A ""section"" is a distinct part or subdivision of something. Answer: ""section"".","Ein ""Abschnitt"" ist ein bestimmter Teil oder eine Unterteilung von etwas. Antwort: ""Abschnitt""."
de,official,offiziell,"An ""official"" is a person who holds a position of authority in an organization or government. Answer: ""official"".","Ein ""Beamter"" ist eine Person, die eine Autoritätsposition in einer Organisation oder Regierung innehat. Antwort: ""Beamter""."
de,hundred,hundert,"A ""hundred"" is a numerical value equal to 10 tens. Answer: ""hundred"".","Ein ""Hunderter"" ist ein numerischer Wert, der 10 Zehner entspricht. Antwort: ""Hundert""."
de,office,Büro,"An ""office"" is a place where people usually do their job. Answer: ""office"".","Ein ""Büro"" ist ein Ort, an dem Menschen normalerweise ihre Arbeit verrichten. Antwort: ""Büro""."
de,rock,Felsen,"A ""rock"" is a solid mineral material forming part of the surface of the earth. Answer: ""rock"".","Ein ""Fels"" ist ein festes mineralisches Material, das einen Teil der Erdoberfläche bildet. Antwort: ""Gestein""."
de,rise,Anstieg,"""A ""rise"" is used to describe an increase or upward movement. Answer: ""rise"".""","""Ein ""Anstieg"" wird verwendet, um einen Anstieg oder eine Aufwärtsbewegung zu beschreiben. Antwort: ""Anstieg""."""
de,left,links,"'A ""left"" is a direction opposite to right. Answer: ""left"".'","Ein ""links"" ist eine Richtung, die der rechten entgegengesetzt ist. Antwort: ""links"".'"
de,sound,Klang,"A ""sound"" is something we hear. Answer: ""sound"".","Ein ""Geräusch"" ist etwas, das wir hören. Antwort: ""Klang""."
de,power,Macht,"""A ""power"" is used to control or influence people or things. Answer: ""power"".""","""Eine ""Macht"" wird benutzt, um Menschen oder Dinge zu kontrollieren oder zu beeinflussen. Antwort: ""Macht""."""
de,summer,Sommer,"""The ""summer"" is a season known for its warm weather. Answer: ""summer"".""","""Der ""Sommer"" ist eine Jahreszeit, die für ihr warmes Wetter bekannt ist. Antwort: ""Sommer""."""
